{
  "formatVersion": "noosphere/v1",
  "source": {
    "name": "Alizé (demo)",
    "url": null,
    "exportedAt": "2026-10-30T00:00:00Z"
  },
  "mode": "full",
  "items": [
    {
      "kind": "Domain",
      "id": "customer",
      "metadata": {
        "name": "Customer",
        "description": "Everything that faces the policyholder: portal, mobile app, CRM and sign-in."
      },
      "spec": {
        "order": 1
      }
    },
    {
      "kind": "Domain",
      "id": "contracts",
      "metadata": {
        "name": "Contracts",
        "description": "Quotes, policies and the documents sent with them."
      },
      "spec": {
        "order": 2
      }
    },
    {
      "kind": "Domain",
      "id": "claims",
      "metadata": {
        "name": "Claims",
        "description": "Claim declaration, assessment and repair."
      },
      "spec": {
        "order": 3
      }
    },
    {
      "kind": "Domain",
      "id": "finance",
      "metadata": {
        "name": "Finance",
        "description": "Billing, payments and accounting."
      },
      "spec": {
        "order": 4
      }
    },
    {
      "kind": "Domain",
      "id": "platform",
      "metadata": {
        "name": "Data and platform",
        "description": "Shared infrastructure: event bus, file exchange, data warehouse and mail."
      },
      "spec": {
        "order": 5
      }
    },
    {
      "kind": "Domain",
      "id": "external",
      "metadata": {
        "name": "Outside Alizé",
        "description": "Partners and providers outside Alizé."
      },
      "spec": {
        "order": 6
      }
    },
    {
      "kind": "Team",
      "id": "banque-azur",
      "metadata": {
        "name": "Banque Azur",
        "description": "External partner."
      },
      "spec": {}
    },
    {
      "kind": "Team",
      "id": "imprimo",
      "metadata": {
        "name": "Imprimo",
        "description": "External partner."
      },
      "spec": {}
    },
    {
      "kind": "Team",
      "id": "reseau-auto",
      "metadata": {
        "name": "Réseau Auto+",
        "description": "External partner."
      },
      "spec": {}
    },
    {
      "kind": "Team",
      "id": "team-crm",
      "metadata": {
        "name": "Team CRM"
      },
      "spec": {
        "contact": "#team-crm"
      }
    },
    {
      "kind": "Team",
      "id": "team-claims",
      "metadata": {
        "name": "Team Claims"
      },
      "spec": {
        "contact": "#team-claims"
      }
    },
    {
      "kind": "Team",
      "id": "team-contracts",
      "metadata": {
        "name": "Team Contracts"
      },
      "spec": {
        "contact": "#team-contracts"
      }
    },
    {
      "kind": "Team",
      "id": "team-data",
      "metadata": {
        "name": "Team Data"
      },
      "spec": {
        "contact": "#team-data"
      }
    },
    {
      "kind": "Team",
      "id": "team-digital",
      "metadata": {
        "name": "Team Digital"
      },
      "spec": {
        "contact": "#team-digital"
      }
    },
    {
      "kind": "Team",
      "id": "team-finance",
      "metadata": {
        "name": "Team Finance"
      },
      "spec": {
        "contact": "#team-finance"
      }
    },
    {
      "kind": "Team",
      "id": "team-payments",
      "metadata": {
        "name": "Team Payments"
      },
      "spec": {
        "contact": "#team-payments"
      }
    },
    {
      "kind": "Team",
      "id": "team-platform",
      "metadata": {
        "name": "Team Platform"
      },
      "spec": {
        "contact": "#team-platform"
      }
    },
    {
      "kind": "Application",
      "id": "portal",
      "metadata": {
        "name": "Customer portal",
        "description": "Self-service website for policyholders: quotes, claims, invoices and contact details."
      },
      "spec": {
        "domainId": "customer",
        "teamId": "team-digital",
        "kind": "app",
        "tech": "React, .NET",
        "lifecycle": "live",
        "visibility": "everyone"
      }
    },
    {
      "kind": "Application",
      "id": "mobile",
      "metadata": {
        "name": "Mobile app"
      },
      "spec": {
        "domainId": "customer",
        "teamId": "team-digital",
        "kind": "app",
        "tech": "Flutter",
        "lifecycle": "live",
        "visibility": "everyone"
      }
    },
    {
      "kind": "Application",
      "id": "crm",
      "metadata": {
        "name": "CRM",
        "description": "Customer master data and the history of every interaction."
      },
      "spec": {
        "domainId": "customer",
        "teamId": "team-crm",
        "kind": "app",
        "tech": "Dynamics 365",
        "lifecycle": "live",
        "visibility": "everyone"
      }
    },
    {
      "kind": "Application",
      "id": "idp",
      "metadata": {
        "name": "Identity"
      },
      "spec": {
        "domainId": "customer",
        "teamId": "team-platform",
        "kind": "saas",
        "tech": "Entra ID",
        "lifecycle": "live",
        "visibility": "everyone"
      }
    },
    {
      "kind": "Application",
      "id": "quotes",
      "metadata": {
        "name": "Quotes",
        "description": "Prices and issues quotes for home and car insurance."
      },
      "spec": {
        "domainId": "contracts",
        "teamId": "team-contracts",
        "kind": "app",
        "tech": "Java",
        "lifecycle": "live",
        "visibility": "everyone"
      }
    },
    {
      "kind": "Application",
      "id": "policies",
      "metadata": {
        "name": "Policies",
        "description": "Policy administration: the source of truth for contracts."
      },
      "spec": {
        "domainId": "contracts",
        "teamId": "team-contracts",
        "kind": "app",
        "tech": "Java, Oracle",
        "lifecycle": "live",
        "visibility": "everyone"
      }
    },
    {
      "kind": "Application",
      "id": "docs",
      "metadata": {
        "name": "Document generation"
      },
      "spec": {
        "domainId": "contracts",
        "teamId": "team-contracts",
        "kind": "app",
        "tech": "Node.js",
        "lifecycle": "live",
        "visibility": "everyone"
      }
    },
    {
      "kind": "Application",
      "id": "claims",
      "metadata": {
        "name": "Claims",
        "description": "Claim handling from declaration to settlement."
      },
      "spec": {
        "domainId": "claims",
        "teamId": "team-claims",
        "kind": "app",
        "tech": "Guidewire",
        "lifecycle": "live",
        "visibility": "everyone"
      }
    },
    {
      "kind": "Application",
      "id": "expert",
      "metadata": {
        "name": "Expert network"
      },
      "spec": {
        "domainId": "claims",
        "teamId": "team-claims",
        "kind": "app",
        "tech": ".NET",
        "lifecycle": "live",
        "visibility": "everyone"
      }
    },
    {
      "kind": "Application",
      "id": "billing",
      "metadata": {
        "name": "Billing",
        "description": "Invoices premiums and sends them by email and post."
      },
      "spec": {
        "domainId": "finance",
        "teamId": "team-finance",
        "kind": "app",
        "tech": ".NET, PostgreSQL",
        "lifecycle": "live",
        "visibility": "everyone"
      }
    },
    {
      "kind": "Application",
      "id": "payments",
      "metadata": {
        "name": "Payments",
        "description": "Direct debits, card payments and bank reconciliation."
      },
      "spec": {
        "domainId": "finance",
        "teamId": "team-payments",
        "kind": "app",
        "tech": "Go",
        "lifecycle": "live",
        "visibility": "everyone"
      }
    },
    {
      "kind": "Application",
      "id": "acct",
      "metadata": {
        "name": "Accounting"
      },
      "spec": {
        "domainId": "finance",
        "teamId": "team-finance",
        "kind": "app",
        "tech": "SAP",
        "lifecycle": "live",
        "visibility": "everyone"
      }
    },
    {
      "kind": "Application",
      "id": "bus",
      "metadata": {
        "name": "Event bus",
        "description": "Kafka cluster carrying business events between applications."
      },
      "spec": {
        "domainId": "platform",
        "teamId": "team-platform",
        "kind": "bus",
        "tech": "Kafka",
        "lifecycle": "live",
        "visibility": "everyone"
      }
    },
    {
      "kind": "Application",
      "id": "sftp",
      "metadata": {
        "name": "File exchange"
      },
      "spec": {
        "domainId": "platform",
        "teamId": "team-platform",
        "kind": "file",
        "tech": "SFTP",
        "lifecycle": "live",
        "visibility": "everyone"
      }
    },
    {
      "kind": "Application",
      "id": "dwh",
      "metadata": {
        "name": "Data warehouse"
      },
      "spec": {
        "domainId": "platform",
        "teamId": "team-data",
        "kind": "data",
        "tech": "Snowflake",
        "lifecycle": "live",
        "visibility": "everyone"
      }
    },
    {
      "kind": "Application",
      "id": "mail",
      "metadata": {
        "name": "Mail gateway",
        "description": "Outbound email relay for every application."
      },
      "spec": {
        "domainId": "platform",
        "teamId": "team-platform",
        "kind": "app",
        "tech": "Postfix",
        "lifecycle": "live",
        "visibility": "everyone"
      }
    },
    {
      "kind": "Application",
      "id": "bank",
      "metadata": {
        "name": "Bank (SEPA)"
      },
      "spec": {
        "domainId": "external",
        "teamId": "banque-azur",
        "kind": "external",
        "lifecycle": "live",
        "visibility": "everyone"
      }
    },
    {
      "kind": "Application",
      "id": "printer",
      "metadata": {
        "name": "Print house"
      },
      "spec": {
        "domainId": "external",